demo_id,text,aigc_risk_index,ai_probability,risk_level,source_dataset,note
hc3_ai_2919,数字学习是一种通过使用计算机来学习的方式。它可以通过收集和分析数据来帮助人们了解世界，并使用这些信息来做出决策。数字学习可以用于各种领域，包括自然语言处理、机器学习、人工智能等。\n\n数字学习可以通过训练模型来达到预测和决策的目的。在训练过程中，模型会从已有的数据中学习规律，并根据这些规律来预测新的数据。这些预测可以用来帮助人们决策，例如，在电子商务中预测哪些产品会更受欢迎，或者在医疗领域中预测哪些病人更有可能患上某种疾病。\n\n数字学习可以使用各种算法来实现，包括机器学习算法、深度学习算法和其他算法。这些算法可以在不同的应用场景中使用，并且可以根据所需的精度和处理能力来选择不同的算法。,99.97,0.9997,高置信高风险,Hello-SimpleAI/HC3-Chinese,公开语料演示样例，来自 Human-ChatGPT 对比语料，不是真实学生作文。
hc3_ai_3828,很抱歉，我不能为您提供关于上海的医院推荐信息。但是，我可以告诉您有关痔疮的信息。\n\n痔疮是一种常见的消化系统疾病，可能会导致肛门或直肠周围的组织发生炎症和肿胀。如果您有痔疮，建议您尽早寻求医疗帮助。痔疮可以通过外科手术治疗，但也有其他治疗选项，包括药物治疗和改变生活方式来缓解症状。\n\n虽然痔疮可能不会危及生命，但它们可能会带来严重的疼痛和不适。如果您不治疗痔疮，它们可能会持续存在，并可能导致感染和其他并发症。因此，建议您尽早寻求医疗帮助，以确保您得到适当的治疗。,99.96,0.9996,高置信高风险,Hello-SimpleAI/HC3-Chinese,公开语料演示样例，来自 Human-ChatGPT 对比语料，不是真实学生作文。
hc3_ai_3804,\n腰酸是常见的症状，可能与许多因素有关，包括运动过度、生活方式、年龄和身体健康状况。如果您担心腰酸可能是由某种健康问题引起的，建议您咨询医生。\n\n在缓解腰酸的同时，还可以尝试以下方法：\n\n保持良好的姿势和正常的体位。\n\n适当运动，促进身体的活动并强健腰部肌肉。\n\n使用较软的床垫和枕头，睡眠时尽量保持身体居中。\n\n适当使用热敷或冰敷，缓解疼痛。\n\n尝试使用药物缓解疼痛，例如阿司匹林或布洛芬。\n\n尝试通过改变生活方式来减轻腰酸，包括减少压力、戒烟戒酒、保证足够的水分摄入等。\n\n如果您觉得腰酸持续不适，或者腰酸伴随其他症状，建议您尽快咨询医生以确定具体原因并获得适当的治疗。,99.96,0.9996,高置信高风险,Hello-SimpleAI/HC3-Chinese,公开语料演示样例，来自 Human-ChatGPT 对比语料，不是真实学生作文。
hc3_ai_3945,肛门湿疹是一种常见的皮肤病，常常会引起瘙痒和皮肤红肿。在患有肛门湿疹的情况下，建议您遵循以下建议：\n\n使用温水清洁肛门：在洗澡时，用温水清洁肛门，可以帮助减轻症状。避免使用香皂或其他清洁剂，因为这些产品可能会刺激皮肤。\n\n使用抗炎药膏：您可以使用医生建议的抗炎药膏涂抹在患处。这些药膏可以帮助减轻红肿和瘙痒。\n\n使用冰块：在患处放置冰块可以帮助减轻瘙痒感。\n\n保持肛门干燥：避免穿过轻的内衣或宽松的裤子，这可能会促使皮肤变湿。\n\n保持卫生：保持肛门周围的卫生，并在使用卫生巾或纸之前洗手。\n\n如果您的肛门湿疹症状持续存在或加重，建议您咨询医生，以获得更加个性化的治疗建议。,99.95,0.9995,高置信高风险,Hello-SimpleAI/HC3-Chinese,公开语料演示样例，来自 Human-ChatGPT 对比语料，不是真实学生作文。
hc3_ai_2920,数字学习是一种通过计算机和其他电子设备来学习的方式。它可以通过各种方式来进行，包括在线课程、软件模拟和游戏、视频教程、电子书等。数字学习具有许多优势，例如可以随时随地学习，可以自行调整学习进度，并且可以提供大量的学习资源。\n\n数字学习可以用于各种学科，包括人文学科、科学技术学科、经济学、法学等。它可以帮助人们提高技能和知识，并且可以为职业发展提供有利的条件。,99.94,0.9994,高置信高风险,Hello-SimpleAI/HC3-Chinese,公开语料演示样例，来自 Human-ChatGPT 对比语料，不是真实学生作文。
hc3_ai_4038,如果你有消化不良或者肠胃不好，中午适合吃什么饭可能取决于你的具体情况和症状。通常而言，当你感到消化不良或者肠胃不适时，应该尽量选择易消化的食物，并避免吃过于油腻、辛辣或者富含膳食纤维的食物。\n\n具体而言，你可以尝试以下几种食物：\n\n粥或者汤：粥或者汤是一种轻松易消化的食物，可以帮助你消化食物。\n\n水果：水果通常富含膳食纤维，有助于促进肠胃蠕动，并帮助你排便。\n\n白面饭：白面饭是一种易消化的碳水化合物，可以帮助你补充能量。\n\n蒸肉：蒸肉是一种轻松易消化的蛋白质食物，可以帮助你补充营养。\n\n蔬菜：蔬菜富含膳食纤维和其他营养物质，可以帮助你保持身体健康。\n\n注意：如果你有严重的消化不良或肠胃问题，应该咨询医生或营养师，以获得专业建议。,99.92,0.9992,高置信高风险,Hello-SimpleAI/HC3-Chinese,公开语料演示样例，来自 Human-ChatGPT 对比语料，不是真实学生作文。
hc3_ai_3041,修道院学校是一种特殊的学校，它主要为修道士或修女提供教育。修道院学校的主要学科包括：\n\n哲学：学习哲学的原理和方法，包括传统哲学和当代哲学。\n\n神学：学习宗教信仰和宗教历史，以及世界宗教的比较研究。\n\n语言学：学习古典语言和现代语言，如希腊语、拉丁语、法语和英语。\n\n历史：学习世界历史，包括世界各地的文明和历史事件。\n\n艺术：学习绘画、雕塑、音乐和其他艺术形式。\n\n体育：学习体育运动和健康生活方式。\n\n修道院学校还可能提供其他学科，如数学、物理、化学等。这些学科的具体内容和课程设置可能会因学校而异。,99.92,0.9992,高置信高风险,Hello-SimpleAI/HC3-Chinese,公开语料演示样例，来自 Human-ChatGPT 对比语料，不是真实学生作文。
hc3_ai_2995,北京西城外国语学校寄宿部应该会有许多设施供学生使用。这些可能包括：\n\n宿舍：寄宿部的学生会住在学校的宿舍里。这些宿舍通常都有单人或双人间，每个房间内会有床、桌子、椅子和衣柜。\n\n食堂：寄宿部的学生可以在学校的食堂就餐。食堂通常会提供多种菜肴供学生选择。\n\n图书馆：寄宿部的学生可以在学校的图书馆借阅书籍、看报纸、杂志等。\n\n运动场：寄宿部的学生可以在学校的运动场上进行体育锻炼。\n\n医务室：寄宿部的学生如果生病，可以去医务室就诊。医务室通常会有医生和护士工作。\n\n活动室：寄宿部的学生可以在学校的活动室里参加各种活动，比如唱歌、跳舞、看电影等。\n\n安全设施：寄宿部的学生的安全是学校的重要考虑。因此，学校会有各种安全设施，比如门禁系统、监控摄像头等。,99.92,0.9992,高置信高风险,Hello-SimpleAI/HC3-Chinese,公开语料演示样例，来自 Human-ChatGPT 对比语料，不是真实学生作文。
hc3_ai_3397,薄料髹涂是一种常用的制造工艺，主要用于保护基材表面，防止磨损和腐蚀。\n\n薄料髹涂一般是在基材表面涂上一层薄薄的涂料，这种涂料通常是环氧树脂、聚氨酯或其他化学物质的混合物。这种涂料具有优异的耐磨性、耐腐蚀性和抗冲击性，可以有效保护基材表面。\n\n薄料髹涂的应用非常广泛，常见的应用领域包括汽车、航空航天、机械制造、电子电器、建筑材料等。通常，薄料髹涂可以用于金属、塑料、陶瓷和其他多种基材，为其增加耐磨性、耐腐蚀性和抗冲击性。\n\n总的来说，薄料髹涂是一种非常有效的保护基材表面的方法，可以显著延长基材的使用寿命，并且可以提高基材的外观质量。,99.91,0.9991,高置信高风险,Hello-SimpleAI/HC3-Chinese,公开语料演示样例，来自 Human-ChatGPT 对比语料，不是真实学生作文。
hc3_ai_2996,北京西城外国语学校寄宿部应该会提供一些基本的设施，包括：\n\n宿舍：学校可能会为学生提供带有单人床、床头柜和衣柜的宿舍。\n\n卫生间：学校可能会在每层提供公共卫生间和洗澡间。\n\n餐厅：学校可能会提供餐厅，为学生提供膳食。\n\n休息室：学校可能会提供休息室，让学生可以在课间休息。\n\n运动场：学校可能会提供运动场，让学生可以进行体育锻炼。\n\n这些设施可能会因学校而异，建议您向学校询问具体情况。,99.91,0.9991,高置信高风险,Hello-SimpleAI/HC3-Chinese,公开语料演示样例，来自 Human-ChatGPT 对比语料，不是真实学生作文。
hc3_ai_3865,非常抱歉，我们不能给出关于个人健康问题的诊断建议。如果您有健康问题，建议您立即就诊。\n\n肺癌是一种常见的恶性肿瘤，常常发现时已处于晚期。肺癌的主要症状包括：\n\n咳嗽：这可能是您所描述的症状之一，可能是干咳或痰咳，甚至可能会咳出血丝。\n\n疼痛：肺癌可能会引起胸部或背部的疼痛。\n\n呼吸困难：肺癌可能会导致呼吸困难，尤其是在进行体力活动时。\n\n其他症状：肺癌还可能会导致体重下降、嗓子疼痛、声音嘶哑等其他症状。\n\n如果您有任何上述症状，建议您立即就诊。只有通过医学检查，才能确定是否患有肺癌或其他疾病，并根据患病情况提供治疗建议。,99.91,0.9991,高置信高风险,Hello-SimpleAI/HC3-Chinese,公开语料演示样例，来自 Human-ChatGPT 对比语料，不是真实学生作文。
hc3_ai_4024,尿床是一个常见的儿童健康问题，也可能是由于儿童的生理或心理因素导致的。如果您的孩子9岁了仍然尿床，建议您考虑以下几点：\n\n首先，建议您让孩子接受儿科检查，以确定是否存在生理因素导致尿床。这可能包括尿道感染、膀胱感染、膀胱结石等。\n\n如果儿科检查没有发现生理因素，您可以考虑尝试调整孩子的日常生活习惯，包括安排固定的排尿时间、鼓励孩子使用卫生间、在睡前给孩子喝水等。\n\n可以尝试使用塑料尿布来帮助孩子控制尿液，或者在床上使用尿布保护垫来帮助床单干燥。\n\n如果以上措施都没有起到作用，您可以考虑寻求心理咨询师的帮助，帮助孩子解决潜在的心理因素导致的尿床问题。\n\n至于中医专家，建议您可以咨询当地的中医院或询问您的医生，他们可以提供专业的建议。,99.9,0.999,高置信高风险,Hello-SimpleAI/HC3-Chinese,公开语料演示样例，来自 Human-ChatGPT 对比语料，不是真实学生作文。
hc3_ai_3901,胸闷变异性哮喘是一种慢性呼吸道疾病，其中胸闷是一种常见的症状。在接受治疗后，患者仍然可能会出现胸闷。胸闷变异性哮喘的治疗通常包括药物治疗和生活方式改变。药物治疗可能包括使用支气管扩张剂、抗炎药、抗过敏药和/或抗生素。\n\n如果您正在使用孟鲁司特纳和地氯雷他定，但没有看到任何好转，建议您立即联系您的医生。您的医生可能会根据您的病情和反应调整治疗方案。\n\n在使用任何药物时，应按照医生的指示使用，并在使用过程中遵守所有注意事项和使用说明。不要自行更改用药方案，也不要停止使用药物，除非您的医生明确指示您这样做。\n\n此外，您可以尝试一些生活方式改变来帮助缓解胸闷变异性哮喘的症状。这可能包括：\n\n避免接触哮喘触发因素，如烟雾、灰尘和动物毛发\n锻炼身体，以增强肺部功能\n在室内保持空气湿度适中\n在睡眠时使\n\n\nRegenerate response,99.9,0.999,高置信高风险,Hello-SimpleAI/HC3-Chinese,公开语料演示样例，来自 Human-ChatGPT 对比语料，不是真实学生作文。
hc3_ai_4018,首先，我需要提醒您，自然流产是一种自然现象，并非人为控制的。如果您发现自己出现流产的迹象，包括：腹痛、腹部肌肉收缩、阴道出血和排出胎盘组织，您应立即就医。\n\n在您就医之前，应尽量避免活动，以免加重身体负担。在就医时，您应告诉医生您的症状和您最近的生活习惯，以便医生能够进行正确的诊断和治疗。\n\n如果您已做过B超检查，但仍然看不到什么东西，这可能是因为胎儿发育不足或其他原因。建议您咨询医生，了解更多信息。\n\n总的来说，在自然流产的情况下，您应尽快就医，并避免过度活动。如果您有任何关于您的健康状况的疑问，应向医生寻求帮助。,99.89,0.9989,高置信高风险,Hello-SimpleAI/HC3-Chinese,公开语料演示样例，来自 Human-ChatGPT 对比语料，不是真实学生作文。
hc3_ai_3084,我无法提供关于炮台山循道卫理中学的具体信息，因为我是一个大型语言模型，我的知识储备是在 2021 年之前建立的，我无法进行浏览和查询最新信息。不过，我可以通过一般的教育理论和实践来回答您的问题。\n\n在设立课程时，学校会考虑许多因素，包括国家和地方教育政策、学生的需求和能力、学校的教学资源和目标等。一般来说，学校会按照一定的标准和要求制定课程计划，并在此基础上安排教学内容和活动。\n\n学校可能会设立不同的课程类型，如必修课、选修课、实践课等。必修课是指学生必须参加的课程，通常包括基础科目，如语文、数学、英语等。选修课是指学生可以根据自己的兴趣和能力选择参加的课程，如体育、音乐、科学等。实践课是指学生能够在真实的环境中实践所学知识和技能的课程，如志愿者服务、实验室实习等。\n\n学校还可能根据学生的年级、能力和特长，设立不同的课程水平,99.89,0.9989,高置信高风险,Hello-SimpleAI/HC3-Chinese,公开语料演示样例，来自 Human-ChatGPT 对比语料，不是真实学生作文。
hc3_ai_53,"脱毛膏通常是通过药物刺激皮肤表面的毛囊，使毛变得软脆并易于脱落。它们通常含有一种化学物质叫做草酸，它能够软化毛囊并使毛脱落。虽然脱毛膏有时可能会对皮肤造成刺激，但是它们通常是安全的，并且在使用时注意避开眼睛和唇部即可。 
然而，如果你对使用脱毛膏有疑虑，或者你担心它可能对你的皮肤造成不良影响，那么你可以考虑使用其他方法除毛。例如，使用剃刀或脱毛器是一种常见的选择。这些方法可能更加自然，并且不会产生化学物质。但是，这些方法也可能带来一些副作用，例如剃刀会使皮肤变得干燥和敏感，脱毛器可能会使皮肤变得红肿。因此，建议在使用剃刀或脱毛器之前，先咨询医生或皮肤科医生。",99.89,0.9989,高置信高风险,Hello-SimpleAI/HC3-Chinese,公开语料演示样例，来自 Human-ChatGPT 对比语料，不是真实学生作文。
hc3_ai_3925,小孩大便干硬可能是由多种原因引起的。其中一些可能的原因包括：\n\n饮食不足：如果小孩摄入的水分和膳食纤维较少，可能会导致大便干硬。\n\n身体代谢问题：某些医学状况，如克罗恩病或肠梗阻，可能会导致大便干硬。\n\n疾病：某些疾病，如肠道感染或胰腺炎，可能会导致大便干硬。\n\n药物使用：服用某些药物，如阿司匹林或某些抗生素，可能会导致大便干硬。\n\n压力：小孩可能会因为压力或焦虑而导致大便干硬。\n\n如果您发现小孩大便干硬，建议您咨询医生，以确定具体原因并采取适当的治疗措施。,99.88,0.9988,高置信高风险,Hello-SimpleAI/HC3-Chinese,公开语料演示样例，来自 Human-ChatGPT 对比语料，不是真实学生作文。
hc3_ai_3895,孕期糖尿病是指怀孕时血糖水平升高的一种情况。这种情况可能对母亲和胎儿造成危害，因此应及时寻求医疗帮助。\n\n在控制孕期糖尿病方面，您可以尝试以下几种方法：\n\n遵循医嘱：您应该按照医生的建议进行饮食和运动，以帮助控制血糖水平。\n\n适当运动：运动可以帮助您保持健康，并有助于控制血糖水平。应该选择适合怀孕期间的运动，并且在进行运动之前应该征求医生的意见。\n\n注意饮食：在怀孕期间，应该注意您的饮食，尽量选择低糖、低脂肪的食物。尽量减少吃水果和蛋糕这类高糖食物的摄入量。\n\n定期监测血糖水平：您应该定期监测血糖水平，以便及时调整治疗方案。\n\n如果您发现自己的血糖水平异常，应立即咨询医生或其他医疗专业人员，以确保您的健康和胎儿的健康得到保障。,99.88,0.9988,高置信高风险,Hello-SimpleAI/HC3-Chinese,公开语料演示样例，来自 Human-ChatGPT 对比语料，不是真实学生作文。
hc3_ai_3678,我很抱歉，但是我是一个计算机程序，无法帮助您借钱。如果您需要贷款，建议您向银行或金融机构寻求帮助。这些机构通常可以提供贷款服务，但是需要您提供有关您的信用历史、资产和负债的信息，并根据您的财务情况进行评估。此外，您也可以考虑向家人或朋友借钱。但是，在借钱之前，建议您先清楚地告诉对方您的偿还能力，并确保您能够按时还清借款。希望这些建议对您有所帮助。,99.87,0.9987,高置信高风险,Hello-SimpleAI/HC3-Chinese,公开语料演示样例，来自 Human-ChatGPT 对比语料，不是真实学生作文。
hc3_ai_3755,\n是的，大三阳也可以母乳喂养。\n\n大三阳是一种抗病毒性免疫抑制状态，这意味着您的免疫系统可能不太强壮，因此您更容易感染疾病。但是，大三阳并不是不能母乳喂养的绝对限制。在许多情况下，母乳喂养可以帮助提高母亲和婴儿的免疫力，并且对婴儿来说也是最健康的选择。\n\n如果您想尝试母乳喂养，建议您咨询医生或哺乳顾问，他们可以帮助您了解您的个人情况，并提供有关母乳喂养的指导和支持。\n\n至于宝宝是否有抗体，建议您和医生讨论。在出生时，婴儿会从母亲身体中获得一些保护性抗体，但是随着时间的推移，这些抗体的水平会逐渐降低。通过母乳喂养，婴儿可以获得母亲体内产生的新抗体，这有助于强化婴儿的免疫系统。但是，这并不意味着婴儿一定会拥有足够的抗体来保护自己免受疾病的侵害。您可以咨询医生，了解更多关于婴儿抗体的信息。,99.87,0.9987,高置信高风险,Hello-SimpleAI/HC3-Chinese,公开语料演示样例，来自 Human-ChatGPT 对比语料，不是真实学生作文。
hc3_ai_3977,如果您的体温达到了39摄氏度，并且您有肠胃性感冒的症状，建议您立即就医。 肠胃性感冒是由病毒引起的胃肠道感染，常见症状包括腹泻、呕吐、腹痛和发热。在治疗之前，医生会对您进行评估，并考虑您的病史、症状和检查结果，然后根据您的情况制定治疗计划。\n\n通常，治疗肠胃性感冒的方法包括：\n\n纠正身体水分平衡：如果您有腹泻或呕吐，可能会导致身体脱水。因此，医生可能会建议您补充水分，例如通过饮用水或含水分的饮料。\n\n控制发热：如果您的体温达到了39摄氏度，医生可能会建议使用退烧药，例如布洛芬或阿司匹林。\n\n调整饮食：医生可能会建议您在恢复期间暂时停止进食，以便胃肠道得到休息。然后，您可以逐渐开始吃轻清淡的食物，例如鸡汤、面条和米饭。\n\n使用药物：如果您的肠胃性感冒是由病毒引起的，那么,99.87,0.9987,高置信高风险,Hello-SimpleAI/HC3-Chinese,公开语料演示样例，来自 Human-ChatGPT 对比语料，不是真实学生作文。
hc3_ai_4022,首先，我需要提醒您，由于我是一个计算机程序，无法代替医生的专业诊断和治疗建议。如果您有任何健康问题，请务必咨询医生或其他医疗专业人员。\n\n宫颈糜烂是指宫颈组织出现溃烂，通常是由于人乳头瘤病毒（HPV）感染所致。这种情况通常可以通过手术或贴膜疗法治疗。\n\n您提到的黄色白带和臭味可能是由于宫颈糜烂引起的感染所致。如果您有这些症状，建议您咨询医生，以便您能得到适当的治疗。医生可能会建议您接受进一步的检查，包括宫颈涂片检查、宫颈活检或宫颈刮片检查，以确定感染的类型和严重程度，并确定最适当的治疗方案。\n\n在接受治疗之前，建议您避免性生活，以防进一步感染。您还应该避免使用清洁剂、抗生素和其他药物，除非您的医生建议您使用。\n\n如果您有任何疑问，请务必咨询您的医生或其他医疗专业人员。,99.87,0.9987,高置信高风险,Hello-SimpleAI/HC3-Chinese,公开语料演示样例，来自 Human-ChatGPT 对比语料，不是真实学生作文。
hc3_ai_3979,钩回是一种心律失常，它可能会导致心跳过缓或过速。这种心律失常可能会导致胸痛、心悸、呼吸困难等症状。如果患有钩回，治疗方式可能包括：\n\n药物治疗：可以使用药物来控制心律或改善心脏功能。\n\n心脏起搏器：如果患有严重的钩回或患有心脏病，可能需要安装心脏起搏器来帮助调节心律。\n\n心脏手术：如果其他治疗方法无效，可能需要进行心脏手术来修复心脏结构或改善心脏功能。\n\n生活方式改变：患有钩回的人可能需要改变生活方式来帮助管理病情。这可能包括戒烟、减少饮酒、锻炼、减少压力等。\n\n在进行治疗时，应咨询医生或心脏专科医生，由他们根据患者的具体情况制定个体化治疗计划。,99.87,0.9987,高置信高风险,Hello-SimpleAI/HC3-Chinese,公开语料演示样例，来自 Human-ChatGPT 对比语料，不是真实学生作文。
hc3_ai_2921,数字学习是一种研究领域，它结合了计算机科学和数学，致力于通过计算机算法来处理数据并学习有用的信息。它主要用于机器学习，即让计算机从数据中学习，并使用这些学习来进行预测或决策。\n\n数字学习涉及到许多不同的领域，如自然语言处理、计算机视觉、推荐系统、强化学习等。它使用各种不同的算法来提取有用信息，如线性回归、决策树、支持向量机、神经网络等。\n\n数字学习在许多领域都有广泛应用，如市场营销、医疗保健、金融服务等。它可以帮助组织处理大量数据，并快速找出有用信息，从而提高效率和决策质量。,99.87,0.9987,高置信高风险,Hello-SimpleAI/HC3-Chinese,公开语料演示样例，来自 Human-ChatGPT 对比语料，不是真实学生作文。
hc3_ai_3281,我无法回答您的问题，因为我是一个计算机程序，并没有关于西昌市发展和改革局的组建时间的信息。我不能进行浏览或查询实时信息。\n\n如果您希望获得有关西昌市发展和改革局的信息，建议您联系当地的政府部门或有关机构，他们可以为您提供更准确的信息。,99.87,0.9987,高置信高风险,Hello-SimpleAI/HC3-Chinese,公开语料演示样例，来自 Human-ChatGPT 对比语料，不是真实学生作文。
hc3_ai_3779,\n成人感冒药通常可以帮助缓解感冒症状，但是并不能治愈感冒。 常见的成人感冒药包括：\n\n阿司匹林：可以缓解感冒常见的症状，如发烧、头痛和关节痛。但是，如果您有胃肠道疾病，慢性肝病或血小板减少的疾病，应避免使用阿司匹林。\n\n解热镇痛药：可以帮助缓解发烧和疼痛。常见的解热镇痛药包括布洛芬（如对乙酰氨基酚）和阿托品（如布洛芬）。这些药物有时会导致腹泻和恶心，因此应按照医嘱使用。\n\n抗病毒药：这类药物可以帮助抑制感冒病毒的复制，从而减少感冒的持续时间。常见的抗病毒药包括达菲（如奥拉西坦）和布洛芬（如达菲）。\n\n在使用感冒药之前，建议您咨询医生或药师，确定最适合您的药物。\n\n注意：如果您感冒症状严重或持续时间超过一周，或者您有其他严重疾病，应立即就医。,99.86,0.9986,高置信高风险,Hello-SimpleAI/HC3-Chinese,公开语料演示样例，来自 Human-ChatGPT 对比语料，不是真实学生作文。
